{
  "patient_id": "patient_easy_sclc_02",
  "category": "sclc",
  "demographics": { "age": 72, "sex": "F", "region": "West" },
  "smoking": "40 pack-years, quit 2014",
  "index_date": "2025-05-20",
  "doc_types": ["ct_chest", "surgical_pathology", "oncology_progress"],
  "generated_by": "claude_api",
  "generation_run_id": "claude-subagent-2026-04-29"
}
