{
  "patient_id": "patient_fake_cancer_06",
  "category": "negative",
  "demographics": {
    "age": 55,
    "sex": "F",
    "region": "Midwest"
  },
  "smoking": "never",
  "index_date": "2025-09-22",
  "doc_types": [
    "pcp_visit",
    "endocrinology_consult"
  ],
  "generated_by": "claude_api",
  "generation_run_id": "claude-subagent-2026-04-29"
}