{
  "patient_id": "patient_fake_cancer_14",
  "category": "sclc",
  "demographics": {
    "age": 67,
    "sex": "M",
    "region": "Midwest"
  },
  "smoking": "55 pack-years, current",
  "index_date": "2024-09-30",
  "doc_types": [
    "ct_chest",
    "surgical_pathology",
    "oncology_progress"
  ],
  "generated_by": "claude_api",
  "generation_run_id": "claude-subagent-2026-04-29"
}