{
  "patient_id": "patient_fake_cancer_02",
  "category": "icd_only",
  "demographics": {
    "age": 69,
    "sex": "M",
    "region": "South"
  },
  "smoking": "28 pack-years, quit 2012",
  "index_date": "2025-04-08",
  "doc_types": [
    "pcp_visit",
    "er_visit",
    "pcp_followup"
  ],
  "generated_by": "claude_api",
  "generation_run_id": "claude-subagent-2026-04-29"
}