{
  "patient_id": "patient_easy_sclc_03",
  "category": "sclc",
  "demographics": { "age": 65, "sex": "M", "region": "South" },
  "smoking": "50 pack-years, current",
  "index_date": "2025-09-12",
  "doc_types": ["ct_chest", "surgical_pathology", "oncology_progress", "pcp_followup"],
  "generated_by": "claude_api",
  "generation_run_id": "claude-subagent-2026-04-29"
}
