{
  "patient_id": "patient_easy_neg_02",
  "category": "negative",
  "demographics": { "age": 62, "sex": "M", "region": "Pacific Northwest" },
  "smoking": "12 pack-years, quit 2000",
  "index_date": "2025-01-19",
  "doc_types": ["pcp_visit", "er_visit", "pcp_followup"],
  "generated_by": "claude_api",
  "generation_run_id": "claude-subagent-2026-04-29"
}
