{
  "patient_id": "patient_fake_cancer_13",
  "category": "probable",
  "demographics": {
    "age": 78,
    "sex": "M",
    "region": "Midwest"
  },
  "smoking": "40 pack-years, quit 1998",
  "index_date": "2025-06-30",
  "doc_types": [
    "ct_chest",
    "pulmonology_consult",
    "oncology_progress"
  ],
  "generated_by": "claude_api",
  "generation_run_id": "claude-subagent-2026-04-29"
}