{
  "patient_id": "patient_confirmed_reread_01",
  "category": "confirmed_nsclc",
  "demographics": { "age": 73, "sex": "M", "region": "Southeast" },
  "smoking": "Current smoker, 50 pack-years",
  "index_date": "2025-03-18",
  "doc_types": ["ct_chest", "surgical_pathology_with_addendum", "oncology_progress", "molecular_pathology"],
  "generated_by": "hand"
}
