{
  "patient_id": "patient_fake_cancer_09",
  "category": "confirmed_nsclc",
  "demographics": {
    "age": 75,
    "sex": "M",
    "region": "Pacific Northwest"
  },
  "smoking": "60 pack-years, current",
  "index_date": "2025-04-22",
  "doc_types": [
    "ct_chest",
    "surgical_pathology",
    "oncology_progress"
  ],
  "generated_by": "claude_api",
  "generation_run_id": "claude-subagent-2026-04-29"
}