{
  "patient_id": "patient_probable_fhx_01",
  "category": "probable",
  "demographics": { "age": 64, "sex": "F", "region": "Northeast" },
  "smoking": "Never smoker; significant secondhand-smoke exposure",
  "index_date": "2024-12-19",
  "doc_types": ["pcp_visit", "ct_chest", "oncology_consult", "oncology_progress"],
  "generated_by": "hand"
}
