{
  "patient_id": "patient_fake_cancer_07",
  "category": "negative",
  "demographics": {
    "age": 80,
    "sex": "M",
    "region": "South"
  },
  "smoking": "35 pack-years, quit 1990",
  "index_date": "2025-08-06",
  "doc_types": [
    "pcp_visit",
    "cardiology_consult",
    "pcp_followup"
  ],
  "generated_by": "claude_api",
  "generation_run_id": "claude-subagent-2026-04-29"
}