{
  "patient_id": "patient_fake_cancer_10",
  "category": "confirmed_nsclc",
  "demographics": {
    "age": 60,
    "sex": "F",
    "region": "Northeast"
  },
  "smoking": "22 pack-years, quit 2020",
  "index_date": "2024-08-14",
  "doc_types": [
    "ct_chest",
    "pulmonology_consult",
    "surgical_pathology",
    "oncology_progress"
  ],
  "generated_by": "claude_api",
  "generation_run_id": "claude-subagent-2026-04-29"
}